turn_id,speaker,start,stop,utterance,interval,delta,questions,end_question,overlap,n_words,source_rows,prev_utt,auto_label
363,5d5eeb06d8bcde00162d73f1,640.44,661.45,"Great. Yeah. Most of the, well the to the island where we have we have uh there are a few restaurants are open busy busier parts of the city where it's um outdoor, a lot of outdoor seating. Yeah most of it's mainly take out. Um Yeah.",0.6800000000000637,1.419999999999959,0,False,False,49,"[363, 365, 367, 369]","yeah, I went to a Mcdonald's a couple of weeks ago and I remember they said they don't you you have to order takeout, you can't order inside there right now. They have that rule, which makes sense, but they have a rule um you've got to order takeout, no indoor dining.",5
371,5d5eeb06d8bcde00162d73f1,663.44,670.64,Um Yeah there's not much else through to me. Yeah.,1.6800000000000637,0.7199999999999136,0,False,False,11,"[371, 373]","Great. Yeah. Most of the, well the to the island where we have we have uh there are a few restaurants are open busy busier parts of the city where it's um outdoor, a lot of outdoor seating. Yeah most of it's mainly take out. Um Yeah.",3
375,5d5eeb06d8bcde00162d73f1,672.44,689.54,Do you think um she was going to say yes. Yeah it's been a interesting few months or a year I guess I would say. Yeah.,0.8900000000001,3.909999999999968,0,False,False,27,"[375, 377, 379, 381]",Um Yeah there's not much else through to me. Yeah.,5
382,57656f6c2bfddf000125cce5,690.0,692.06,evidently,0.4600000000000364,2.059999999999945,0,False,False,1,[382],Do you think um she was going to say yes. Yeah it's been a interesting few months or a year I guess I would say. Yeah.,2
383,5d5eeb06d8bcde00162d73f1,690.04,693.35,Mhm. Yeah. Okay.,-2.019999999999982,3.310000000000059,0,False,True,3,[383],evidently,1
384,57656f6c2bfddf000125cce5,693.24,693.45,it's,-0.1100000000000136,0.2100000000000363,0,False,True,2,[384],Mhm. Yeah. Okay.,1
387,5d5eeb06d8bcde00162d73f1,696.34,699.32,Do you do you live by yourself? Did you have like roommates or friends,0.7900000000000773,0.4499999999999318,0,False,False,14,"[387, 389]",it's,5
390,57656f6c2bfddf000125cce5,698.9,700.29,I,-0.4200000000000727,1.3899999999999864,0,False,True,1,[390],Do you do you live by yourself? Did you have like roommates or friends,3
391,5d5eeb06d8bcde00162d73f1,699.32,699.66,or?,-0.9699999999999136,0.3399999999999181,1,True,True,1,[391],I,1
392,57656f6c2bfddf000125cce5,700.3,706.87,"live with just my mother right now, yeah.",0.6399999999999864,1.3600000000000136,0,False,False,8,"[392, 394, 396]",or?,4
397,5d5eeb06d8bcde00162d73f1,704.34,706.16,Yeah this guy's,-2.5299999999999727,1.8199999999999363,0,False,True,4,[397],"live with just my mother right now, yeah.",2
398,57656f6c2bfddf000125cce5,706.88,709.46,And you live with your your roommates?,0.7200000000000273,2.580000000000041,1,True,False,7,[398],Yeah this guy's,2
401,5d5eeb06d8bcde00162d73f1,710.58,725.76,"I'll probably around thanksgiving go back to visit my family. Um uh Yeah I have to go back then in a couple of weeks but right now it's just me in there, roommates.",-9.069999999999936,15.17999999999995,0,False,True,35,[401],And you live with your your roommates?,4
404,57656f6c2bfddf000125cce5,731.04,733.65,"Um Do you get along with them? All right,",0.7799999999999727,2.6100000000000136,1,False,False,9,[404],"I'll probably around thanksgiving go back to visit my family. Um uh Yeah I have to go back then in a couple of weeks but right now it's just me in there, roommates.",3
405,5d5eeb06d8bcde00162d73f1,733.54,739.75,"Mhm. Oh yeah, no, we're all, we're all pretty close. Many I think I yeah, we all met together",-0.1100000000000136,6.210000000000036,0,False,True,21,[405],"Um Do you get along with them? All right,",5
406,57656f6c2bfddf000125cce5,740.31,740.76,that's,0.5599999999999454,0.4500000000000455,0,False,False,2,[406],"Mhm. Oh yeah, no, we're all, we're all pretty close. Many I think I yeah, we all met together",3
407,5d5eeb06d8bcde00162d73f1,740.64,740.87,and,-0.1200000000000045,0.2300000000000182,0,False,True,1,[407],that's,1
408,57656f6c2bfddf000125cce5,740.76,741.06,just,-0.1100000000000136,0.2999999999999545,0,False,True,1,[408],and,1
409,5d5eeb06d8bcde00162d73f1,740.88,741.12,um,-0.1799999999999499,0.2400000000000091,0,False,True,1,[409],just,2
410,57656f6c2bfddf000125cce5,741.06,741.63,good.,-0.0600000000000591,0.57000000000005,0,False,True,1,[410],um,1
411,5d5eeb06d8bcde00162d73f1,741.13,783.26,"this organization in school and we, I've been friends since then, so yeah, no, they're great. Um I couldn't imagine living with any other people, so it's definitely nice. Um definitely helps because I made a previous two years. I was um well I hadn't wondering maybe, but I wouldn't see them too often, so pretty much had the place to myself that got a little boring granted. It was pretty pandemic, so it was still okay, but I can't imagine living with myself right now. Um Yeah. Yeah. What do any plans for the absurd,",-0.5,38.63,0,False,True,103,"[411, 413, 415, 417]",good.,5
418,57656f6c2bfddf000125cce5,784.3,785.15,Go on.,1.0399999999999636,0.8500000000000227,0,False,False,2,[418],"this organization in school and we, I've been friends since then, so yeah, no, they're great. Um I couldn't imagine living with any other people, so it's definitely nice. Um definitely helps because I made a previous two years. I was um well I hadn't wondering maybe, but I wouldn't see them too often, so pretty much had the place to myself that got a little boring granted. It was pretty pandemic, so it was still okay, but I can't imagine living with myself right now. Um Yeah. Yeah. What do any plans for the absurd,",2
419,5d5eeb06d8bcde00162d73f1,785.44,788.85,"Oh yeah. Do you have any plans for the weekend or? Right,",0.2900000000000773,1.7799999999999727,0,False,False,12,"[419, 421]",Go on.,5
422,57656f6c2bfddf000125cce5,790.76,795.05,"You see, I uh I think I'm visiting a",1.909999999999968,4.289999999999964,0,False,False,10,[422],"Oh yeah. Do you have any plans for the weekend or? Right,",5
423,5d5eeb06d8bcde00162d73f1,795.04,795.25,"mm,",-0.0099999999999909,0.2100000000000363,0,False,True,1,[423],"You see, I uh I think I'm visiting a",1
424,57656f6c2bfddf000125cce5,795.05,796.56,family member this weekend.,-0.2000000000000454,1.509999999999991,0,False,True,4,[424],"mm,",2
425,5d5eeb06d8bcde00162d73f1,796.84,797.46,"mm hmm,",0.2800000000000864,0.6200000000000045,0,False,False,2,[425],family member this weekend.,1
426,57656f6c2bfddf000125cce5,797.54,802.16,"Uh Yeah, that's that's the main thing.",0.0799999999999272,4.6200000000000045,0,False,False,9,[426],"mm hmm,",2
427,5d5eeb06d8bcde00162d73f1,802.54,803.46,that's good. Right.,0.3799999999999954,0.3500000000000227,0,False,False,4,"[427, 429]","Uh Yeah, that's that's the main thing.",1
430,57656f6c2bfddf000125cce5,805.23,806.36,Do you have any plants?,1.7699999999999818,1.1299999999999957,1,True,False,5,[430],that's good. Right.,2
431,5d5eeb06d8bcde00162d73f1,808.14,838.99,"Um uh no, I guess just kind of, I guess we'll see what happens this weekend. Yeah. Nothing exciting plan. Probably just doing work for classes. Will have exams in um here in a couple of weeks. I might have to start getting ready for thought and then um Yeah. Yeah. Really? Something interesting.",1.7799999999999727,3.919999999999959,0,False,False,55,"[431, 433, 435, 437]",Do you have any plants?,5
443,5d5eeb06d8bcde00162d73f1,845.54,845.96,"Well,",-1.25,0.4200000000000727,0,False,True,1,[443],"Um uh no, I guess just kind of, I guess we'll see what happens this weekend. Yeah. Nothing exciting plan. Probably just doing work for classes. Will have exams in um here in a couple of weeks. I might have to start getting ready for thought and then um Yeah. Yeah. Really? Something interesting.",4
444,57656f6c2bfddf000125cce5,846.79,847.45,so,0.8299999999999272,0.6600000000000819,0,False,False,1,[444],"Well,",4
445,5d5eeb06d8bcde00162d73f1,847.74,847.95,can,0.2899999999999636,0.2100000000000363,0,False,False,1,[445],so,4
446,57656f6c2bfddf000125cce5,847.84,857.57,"um if you're in college and I'm guessing now is when um the courses start getting more difficult in the middle of november,",-0.1100000000000136,3.919999999999959,0,False,True,25,"[446, 448]",can,5
449,5d5eeb06d8bcde00162d73f1,858.74,872.01,"Um I wouldn't uh I guess it depends on the classes, it's going to be more difficult, but it is, it's a lot more work piled on now. You know, we have like different",1.169999999999959,13.269999999999982,0,False,False,37,[449],"um if you're in college and I'm guessing now is when um the courses start getting more difficult in the middle of november,",5
450,57656f6c2bfddf000125cce5,871.94,872.3,it's,-0.0699999999999363,0.3599999999998999,0,False,True,2,[450],"Um I wouldn't uh I guess it depends on the classes, it's going to be more difficult, but it is, it's a lot more work piled on now. You know, we have like different",2
451,5d5eeb06d8bcde00162d73f1,872.01,872.77,projects,-0.2899999999999636,0.7599999999999909,0,False,True,1,[451],it's,1
452,57656f6c2bfddf000125cce5,872.3,873.07,complicated,-0.4700000000000273,0.7700000000000955,0,False,True,1,[452],projects,4
453,5d5eeb06d8bcde00162d73f1,872.77,894.85,"and papers and research projects and exams of course and stuff going on and then um didn't because for no final year. So like applying to jobs and interviews and all kinds of stuff going on. So that's a little chaotic. Yeah. Yeah,",-0.3000000000000682,22.08000000000004,0,False,True,45,[453],complicated,5
454,57656f6c2bfddf000125cce5,894.77,894.95,and,-0.0800000000000409,0.1800000000000636,0,False,True,1,[454],"and papers and research projects and exams of course and stuff going on and then um didn't because for no final year. So like applying to jobs and interviews and all kinds of stuff going on. So that's a little chaotic. Yeah. Yeah,",1
455,5d5eeb06d8bcde00162d73f1,894.85,895.07,I guess,-0.1000000000000227,0.2200000000000272,0,False,True,2,[455],and,1
456,57656f6c2bfddf000125cce5,894.95,895.4,then everything,-0.1200000000000045,0.4499999999999318,0,False,True,2,[456],I guess,1
457,5d5eeb06d8bcde00162d73f1,895.07,895.73,"it's pretty difficult,",-0.3299999999999272,0.6599999999999682,0,False,True,4,[457],then everything,1
458,57656f6c2bfddf000125cce5,895.69,896.01,around,-0.0399999999999636,0.3199999999999363,0,False,True,1,[458],"it's pretty difficult,",3
459,5d5eeb06d8bcde00162d73f1,895.73,896.12,at least for,-0.2799999999999727,0.3899999999999863,0,False,True,3,[459],around,4
460,57656f6c2bfddf000125cce5,896.01,896.1,and,-0.1100000000000136,0.0900000000000318,0,False,True,1,[460],at least for,1
461,5d5eeb06d8bcde00162d73f1,896.12,897.16,me to like balance all,0.0199999999999818,1.0399999999999636,0,False,False,5,[461],and,5
462,57656f6c2bfddf000125cce5,897.01,897.27,not,-0.1499999999999772,0.2599999999999909,0,False,True,1,[462],me to like balance all,2
463,5d5eeb06d8bcde00162d73f1,897.16,897.68,of those,-0.1100000000000136,0.5199999999999818,0,False,True,2,[463],not,1
464,57656f6c2bfddf000125cce5,897.27,897.79,at all,-0.4099999999999681,0.5199999999999818,0,False,True,2,[464],of those,1
465,5d5eeb06d8bcde00162d73f1,897.69,898.21,different,-0.099999999999909,0.5199999999999818,0,False,True,1,[465],at all,1
466,57656f6c2bfddf000125cce5,897.91,898.53,like screaming,-0.3000000000000682,0.6200000000000045,0,False,True,2,[466],different,1
467,5d5eeb06d8bcde00162d73f1,898.21,898.55,things at,-0.3199999999999363,0.3399999999999181,0,False,True,2,[467],like screaming,3
468,57656f6c2bfddf000125cce5,898.53,898.64,at,-0.0199999999999818,0.1100000000000136,0,False,True,1,[468],things at,1
469,5d5eeb06d8bcde00162d73f1,898.55,898.93,"once,",-0.0900000000000318,0.3799999999999954,0,False,True,1,[469],at,1
470,57656f6c2bfddf000125cce5,898.64,899.07,something.,-0.2899999999999636,0.4300000000000636,0,False,True,1,[470],"once,",1
471,5d5eeb06d8bcde00162d73f1,898.93,915.31,"But, you know, we'll see what happens, right? Um Yeah. Okay.",-0.1400000000001,3.620000000000005,0,False,True,12,"[471, 473]",something.,4
475,5d5eeb06d8bcde00162d73f1,920.34,929.35,"Yeah, it's kind of hard to make plans now for, you know, like different breaks and stuff because there's nowhere to come. Um",2.080000000000041,3.519999999999982,0,False,False,25,"[475, 477, 479]","But, you know, we'll see what happens, right? Um Yeah. Okay.",4
480,57656f6c2bfddf000125cce5,927.97,928.75,"There,",-1.3799999999999957,0.7799999999999727,0,False,True,1,[480],"Yeah, it's kind of hard to make plans now for, you know, like different breaks and stuff because there's nowhere to come. Um",4
481,5d5eeb06d8bcde00162d73f1,929.94,930.74,"I was there, yeah,",1.1900000000000546,0.1499999999999772,0,False,False,4,"[481, 483]","There,",4
484,57656f6c2bfddf000125cce5,931.94,934.55,"Oh yeah, there's not as many places to go.",1.2000000000000457,2.6099999999999,0,False,False,10,[484],"I was there, yeah,",4
485,5d5eeb06d8bcde00162d73f1,934.94,946.85,"yeah. Uh Yeah, yeah, what else is there? Mm Yeah, yeah.",0.3900000000001,11.909999999999968,1,False,False,11,[485],"Oh yeah, there's not as many places to go.",3
486,57656f6c2bfddf000125cce5,949.34,956.61,Thank,2.490000000000009,7.269999999999982,0,False,False,1,[486],"yeah. Uh Yeah, yeah, what else is there? Mm Yeah, yeah.",1
487,5d5eeb06d8bcde00162d73f1,949.44,956.73,Have you been doing anything like maybe taking up any hobbies or anything during this time to like for,-7.169999999999959,7.289999999999964,0,False,True,19,[487],Thank,5
488,57656f6c2bfddf000125cce5,956.62,958.67,you. Uh,-0.1100000000000136,2.0499999999999545,0,False,True,2,[488],Have you been doing anything like maybe taking up any hobbies or anything during this time to like for,1
489,5d5eeb06d8bcde00162d73f1,956.73,959.05,fun or something? Yeah.,-1.9399999999999409,2.3199999999999363,1,False,True,4,[489],you. Uh,2
490,57656f6c2bfddf000125cce5,958.75,961.16,I spend time playing video games.,-0.2999999999999545,1.17999999999995,0,False,True,6,"[490, 492]",fun or something? Yeah.,4
493,5d5eeb06d8bcde00162d73f1,961.34,962.15,mm hmm.,0.1800000000000636,0.8099999999999454,0,False,False,2,[493],I spend time playing video games.,1
496,57656f6c2bfddf000125cce5,963.44,973.69,"Okay, I guess the main system I'm playing right now is I have a three D. S. Um uh",0.0800000000000409,10.25,0,False,False,20,[496],mm hmm.,4
497,5d5eeb06d8bcde00162d73f1,973.34,973.96,Um,-0.3500000000000227,0.6200000000000045,0,False,True,1,[497],"Okay, I guess the main system I'm playing right now is I have a three D. S. Um uh",2
498,57656f6c2bfddf000125cce5,973.7,975.26,Do you have any video game systems?,-0.2599999999999909,0.9099999999999682,0,False,True,7,"[498, 500]",Um,2
501,5d5eeb06d8bcde00162d73f1,975.54,987.76,I did when I was one of my roommates has a it's the not to us what is the the the Nintendo switch,0.2799999999999727,7.310000000000059,0,False,False,24,"[501, 503]",Do you have any video game systems?,5
504,57656f6c2bfddf000125cce5,988.14,989.65,"I'll switch,",0.3799999999999954,1.509999999999991,0,False,False,3,[504],I did when I was one of my roommates has a it's the not to us what is the the the Nintendo switch,5
505,5d5eeb06d8bcde00162d73f1,989.34,993.2,"switch? Yeah, so we've been some, once in a while, we'll play",-0.3099999999999454,3.8600000000000136,1,False,True,14,[505],"I'll switch,",3
506,57656f6c2bfddf000125cce5,993.14,993.29,mm,-0.0600000000000591,0.1499999999999772,0,False,True,1,[506],"switch? Yeah, so we've been some, once in a while, we'll play",2
507,5d5eeb06d8bcde00162d73f1,993.2,1001.27,"like um what do we play, like Mario Kart or something with all of that? I don't think that too many games on it. Yeah.",-0.0899999999999181,0.25,0,False,True,26,"[507, 509]",mm,5
510,57656f6c2bfddf000125cce5,1001.13,1001.59,No.,-0.1399999999999863,0.4600000000000364,0,False,True,1,[510],"like um what do we play, like Mario Kart or something with all of that? I don't think that too many games on it. Yeah.",1
511,5d5eeb06d8bcde00162d73f1,1001.94,1007.26,"Um but yeah, what do you have? Oh, you said you have? Uh Diaz?",0.3500000000000227,0.7199999999999136,0,False,False,14,"[511, 513, 515, 517]",No.,5
518,57656f6c2bfddf000125cce5,1006.94,1010.73,Mhm. Yeah three D. S. Um There's this game I'm playing,-0.3199999999999363,2.009999999999991,0,False,True,13,"[518, 520, 522, 524]","Um but yeah, what do you have? Oh, you said you have? Uh Diaz?",3
525,5d5eeb06d8bcde00162d73f1,1010.54,1011.11,Yes.,-0.1900000000000545,0.57000000000005,0,False,True,1,[525],Mhm. Yeah three D. S. Um There's this game I'm playing,1
526,57656f6c2bfddf000125cce5,1010.74,1013.85,called let me see. Okay.,-0.3700000000000045,3.1100000000000136,0,False,True,5,[526],Yes.,2
530,57656f6c2bfddf000125cce5,1018.34,1022.47,Oh zero escape I think that's that's the name of the game.,0.07000000000005,4.129999999999996,0,False,False,14,[530],called let me see. Okay.,5
531,5d5eeb06d8bcde00162d73f1,1021.84,1024.77,Mhm. I,-0.6299999999999955,2.92999999999995,0,False,True,2,[531],Oh zero escape I think that's that's the name of the game.,1
532,57656f6c2bfddf000125cce5,1024.04,1025.77,What? Yeah.,-0.7300000000000182,1.7300000000000182,1,False,True,2,[532],Mhm. I,2
533,5d5eeb06d8bcde00162d73f1,1025.94,1030.55,"that, I think I've heard of it ever seen it before, I don't have it, but um",0.1700000000000727,2.1299999999998818,0,False,False,19,"[533, 535, 537]",What? Yeah.,3
538,57656f6c2bfddf000125cce5,1031.24,1046.17,I think it's sort of have you ever it's sort of like an about an escape room? Uh There's like nine people trapped in a escape in a room or in some sort of dungeon that they don't know how they got there and they're trying to figure out how to escape.,0.6900000000000546,2.220000000000028,0,False,False,57,"[538, 540, 542, 544]","that, I think I've heard of it ever seen it before, I don't have it, but um",3
547,5d5eeb06d8bcde00162d73f1,1048.82,1052.86,So is it like different like ruins every time or,-1.240000000000009,4.039999999999964,0,False,True,10,[547],I think it's sort of have you ever it's sort of like an about an escape room? Uh There's like nine people trapped in a escape in a room or in some sort of dungeon that they don't know how they got there and they're trying to figure out how to escape.,4
548,57656f6c2bfddf000125cce5,1053.94,1055.05,Yes,1.0800000000001546,1.1099999999999,0,False,False,1,[548],So is it like different like ruins every time or,2
549,5d5eeb06d8bcde00162d73f1,1054.54,1056.16,is it like for you?,-0.5099999999999909,1.6200000000001182,1,True,True,5,[549],Yes,4
550,57656f6c2bfddf000125cce5,1056.64,1064.77,"there's a lot of rooms I guess in puzzles too solve and I guess you don't know where the next room leads into,",0.4800000000000182,1.2299999999997908,0,False,False,25,"[550, 552, 554]",is it like for you?,4
555,5d5eeb06d8bcde00162d73f1,1064.24,1084.86,"Mhm. Okay, that's fine. Yeah, I've been trying to look for something to video games. I one of my own on my roommates, one of my friends um do you do a lot of like online games or like that? Like what is it called? Like Steam or something? Mhm.",-0.5299999999999727,3.1400000000001,0,False,True,52,"[555, 557, 559, 561, 563]","there's a lot of rooms I guess in puzzles too solve and I guess you don't know where the next room leads into,",2
564,57656f6c2bfddf000125cce5,1084.94,1086.95,I played some on Steam before.,0.0800000000001546,2.009999999999991,0,False,False,6,[564],"Mhm. Okay, that's fine. Yeah, I've been trying to look for something to video games. I one of my own on my roommates, one of my friends um do you do a lot of like online games or like that? Like what is it called? Like Steam or something? Mhm.",2
565,5d5eeb06d8bcde00162d73f1,1087.54,1110.76,"Okay. Yeah. Trying to think. There's something I'd like to called the name is um yeah, I don't know sometimes have issues because I try to download to me games or something on my laptop, but then it um there's never enough space so to save anything, but you know.",0.5899999999999181,22.62000000000012,0,False,False,54,"[565, 567]",I played some on Steam before.,5
568,57656f6c2bfddf000125cce5,1111.04,1115.36,"Yeah, I know Steam has so many different games",0.2799999999999727,4.319999999999936,0,False,False,9,[568],"Okay. Yeah. Trying to think. There's something I'd like to called the name is um yeah, I don't know sometimes have issues because I try to download to me games or something on my laptop, but then it um there's never enough space so to save anything, but you know.",2
569,5d5eeb06d8bcde00162d73f1,1114.74,1117.35,"Mhm, mm hmm.",-0.6199999999998909,2.6099999999999,0,False,True,3,[569],"Yeah, I know Steam has so many different games",1
570,57656f6c2bfddf000125cce5,1116.54,1125.27,"uh I guess it could be easy to, you could like just buy a bunch of games, but then you realize you don't have enough time to play them all.",-0.8099999999999454,4.8400000000001455,0,False,True,31,"[570, 572]","Mhm, mm hmm.",5
573,5d5eeb06d8bcde00162d73f1,1125.34,1156.17,Mhm. Yeah. Well that's one thing I think my laptop itself I don't know it's been kind of old now but um storage issue. they have had what was it Steam I think every once in a while they get like yeah like certain games that are Like for free or something you download for like a week or two. Um If you download it between those like time periods then you can get it for free and have it fate forever. Yeah,0.0699999999999363,4.779999999999973,0,False,False,86,"[573, 575, 579, 581]","uh I guess it could be easy to, you could like just buy a bunch of games, but then you realize you don't have enough time to play them all.",5
582,57656f6c2bfddf000125cce5,1156.84,1161.81,"I've heard of that before, I know they have sales sometimes, some",0.6699999999998454,4.970000000000027,0,False,False,13,[582],Mhm. Yeah. Well that's one thing I think my laptop itself I don't know it's been kind of old now but um storage issue. they have had what was it Steam I think every once in a while they get like yeah like certain games that are Like for free or something you download for like a week or two. Um If you download it between those like time periods then you can get it for free and have it fate forever. Yeah,2
583,5d5eeb06d8bcde00162d73f1,1161.24,1161.96,mm hmm.,-0.5699999999999363,0.7200000000000273,0,False,True,2,[583],"I've heard of that before, I know they have sales sometimes, some",1
584,57656f6c2bfddf000125cce5,1161.82,1162.36,of that.,-0.1400000000001,0.5399999999999636,0,False,True,2,[584],mm hmm.,1
585,5d5eeb06d8bcde00162d73f1,1162.84,1167.82,Yeah and I don't really play to me well granted before the pandemic a clear street,0.4800000000000182,3.050000000000182,0,False,False,17,"[585, 587]",of that.,5
588,57656f6c2bfddf000125cce5,1167.74,1168.36,Problem.,-0.0799999999999272,0.6199999999998909,0,False,True,1,[588],Yeah and I don't really play to me well granted before the pandemic a clear street,2
589,5d5eeb06d8bcde00162d73f1,1167.82,1176.27,but now so I don't really purchase too many are really purchase any of them but sometimes they have a couple of free ones. I'll take a look at them and see what they're about. Yeah.,-0.5399999999999636,1.3400000000001455,0,False,True,39,"[589, 591, 593]",Problem.,5
595,5d5eeb06d8bcde00162d73f1,1177.84,1182.87,Um I used to days when I was younger I,-0.1000000000001364,0.7200000000000273,0,False,True,10,"[595, 597, 599]",but now so I don't really purchase too many are really purchase any of them but sometimes they have a couple of free ones. I'll take a look at them and see what they're about. Yeah.,3
600,57656f6c2bfddf000125cce5,1182.84,1183.19,just,-0.0299999999999727,0.3500000000001364,0,False,True,1,[600],Um I used to days when I was younger I,2
601,5d5eeb06d8bcde00162d73f1,1182.87,1183.52,had a,-0.3200000000001637,0.650000000000091,0,False,True,2,[601],just,2
602,57656f6c2bfddf000125cce5,1183.19,1183.46,maybe.,-0.3299999999999272,0.2699999999999818,0,False,True,1,[602],had a,1
603,5d5eeb06d8bcde00162d73f1,1183.53,1188.56,P. S. 22 Yeah this is many years ago.,0.0699999999999363,1.1400000000001,0,False,False,9,"[603, 605, 607]",maybe.,3
608,57656f6c2bfddf000125cce5,1189.14,1189.47,What?,0.5800000000001546,0.3299999999999272,1,True,False,1,[608],P. S. 22 Yeah this is many years ago.,1
609,5d5eeb06d8bcde00162d73f1,1189.34,1195.76,Um Yeah I've played video games in a while.,-0.1300000000001091,3.230000000000018,0,False,True,10,"[609, 611]",What?,3
614,57656f6c2bfddf000125cce5,1197.14,1207.56,"I still play them though, I don't don't spend as much time as I used to when I was younger, I used to spend a lot more time playing them. Thanks.",-0.209999999999809,4.409999999999855,0,False,True,33,"[614, 616, 618]",Um Yeah I've played video games in a while.,4
619,5d5eeb06d8bcde00162d73f1,1208.18,1215.27,I definitely did too. Did you also have like do you have like a like what did you play them on?,0.6200000000001182,2.75,0,False,False,21,"[619, 621, 623, 625]","I still play them though, I don't don't spend as much time as I used to when I was younger, I used to spend a lot more time playing them. Thanks.",5
626,57656f6c2bfddf000125cce5,1216.04,1223.89,At a PlayStation two and uh a game cube,0.7699999999999818,2.730000000000018,0,False,False,9,"[626, 628, 630]",I definitely did too. Did you also have like do you have like a like what did you play them on?,4
631,5d5eeb06d8bcde00162d73f1,1222.74,1222.95,No.,-1.150000000000091,0.2100000000000363,0,False,True,1,[631],At a PlayStation two and uh a game cube,1
632,57656f6c2bfddf000125cce5,1223.9,1227.27,and um intended we that was some of the ones say.,0.9500000000000456,2.5499999999999545,0,False,False,11,"[632, 634]",No.,5
